Trial 72 finished with value: 0.6321220779747878 and parameters: {'crossover_prob': 0.7057644060973103, 'crossover_eta': 5, 'mutation_prob': 0.6396981364289595, 'mutation_eta': 5, 'sampling': 'LHS', 'selection': 'RandomSelection'}. Best is trial 54 with value: 0.6197490814338504.
Trial 75 finished with value: 0.733654303413875 and parameters: {'crossover_prob': 0.7068616452636974, 'crossover_eta': 3, 'mutation_prob': 0.7244957567782098, 'mutation_eta': 6, 'sampling': 'LHS', 'selection': 'RandomSelection'}. Best is trial 54 with value: 0.6197490814338504.
Trial 23 finished with value: 0.735070466662242 and parameters: {'crossover_prob': 0.13909902179502076, 'crossover_eta': 20, 'mutation_prob': 0.026425845653202718, 'mutation_eta': 21, 'sampling': 'LHS', 'selection': 'TournamentSelection'}. Best is trial 54 with value: 0.6197490814338504.
Trial 73 finished with value: 0.6403702295921868 and parameters: {'crossover_prob': 0.7166034713839065, 'crossover_eta': 5, 'mutation_prob': 0.628087654253362, 'mutation_eta': 5, 'sampling': 'LHS', 'selection': 'RandomSelection'}. Best is trial 54 with value: 0.6197490814338504.
Trial 74 finished with value: 0.6463384077090528 and parameters: {'crossover_prob': 0.7216011368701214, 'crossover_eta': 4, 'mutation_prob': 0.6341433090779955, 'mutation_eta': 6, 'sampling': 'LHS', 'selection': 'RandomSelection'}. Best is trial 54 with value: 0.6197490814338504.
Trial 76 finished with value: 0.6547871765545422 and parameters: {'crossover_prob': 0.7291115689068248, 'crossover_eta': 4, 'mutation_prob': 0.7271456657642212, 'mutation_eta': 6, 'sampling': 'LHS', 'selection': 'RandomSelection'}. Best is trial 54 with value: 0.6197490814338504.
Trial 77 finished with value: 0.6705749156637945 and parameters: {'crossover_prob': 0.7058850685892022, 'crossover_eta': 5, 'mutation_prob': 0.6357850409848371, 'mutation_eta': 6, 'sampling': 'LHS', 'selection': 'RandomSelection'}. Best is trial 54 with value: 0.6197490814338504.
Trial 80 finished with value: 0.6547579911920637 and parameters: {'crossover_prob': 0.7250908710686543, 'crossover_eta': 5, 'mutation_prob': 0.7460612993511232, 'mutation_eta': 6, 'sampling': 'LHS', 'selection': 'RandomSelection'}. Best is trial 54 with value: 0.6197490814338504.
Trial 82 finished with value: 0.6764008406729409 and parameters: {'crossover_prob': 0.883268967718393, 'crossover_eta': 5, 'mutation_prob': 0.7348063469315776, 'mutation_eta': 6, 'sampling': 'LHS', 'selection': 'TournamentSelection'}. Best is trial 54 with value: 0.6197490814338504.
Trial 79 finished with value: 0.792712130965535 and parameters: {'crossover_prob': 0.7294516479927443, 'crossover_eta': 5, 'mutation_prob': 0.7228648302593785, 'mutation_eta': 6, 'sampling': 'LHS', 'selection': 'RandomSelection'}. Best is trial 54 with value: 0.6197490814338504.
Trial 78 finished with value: 0.6968362370776922 and parameters: {'crossover_prob': 0.7336755197233571, 'crossover_eta': 5, 'mutation_prob': 0.7088754383321804, 'mutation_eta': 6, 'sampling': 'LHS', 'selection': 'RandomSelection'}. Best is trial 54 with value: 0.6197490814338504.
Trial 84 finished with value: 0.8983078653677002 and parameters: {'crossover_prob': 0.8952019993368896, 'crossover_eta': 14, 'mutation_prob': 0.7344188829643751, 'mutation_eta': 5, 'sampling': 'LHS', 'selection': 'TournamentSelection'}. Best is trial 54 with value: 0.6197490814338504.
Trial 81 finished with value: 0.6643994312878065 and parameters: {'crossover_prob': 0.7154330752188031, 'crossover_eta': 5, 'mutation_prob': 0.7261106718240229, 'mutation_eta': 6, 'sampling': 'LHS', 'selection': 'TournamentSelection'}. Best is trial 54 with value: 0.6197490814338504.
Trial 83 finished with value: 0.7360008032879788 and parameters: {'crossover_prob': 0.8791063866895931, 'crossover_eta': 14, 'mutation_prob': 0.7134018972645921, 'mutation_eta': 6, 'sampling': 'LHS', 'selection': 'TournamentSelection'}. Best is trial 54 with value: 0.6197490814338504.
Trial 87 finished with value: 0.6598868448600167 and parameters: {'crossover_prob': 0.8688243369603811, 'crossover_eta': 14, 'mutation_prob': 0.7317976142671868, 'mutation_eta': 5, 'sampling': 'LHS', 'selection': 'RandomSelection'}. Best is trial 54 with value: 0.6197490814338504.
Trial 85 finished with value: 0.6922065211149524 and parameters: {'crossover_prob': 0.8666081723705633, 'crossover_eta': 15, 'mutation_prob': 0.7508516077105287, 'mutation_eta': 6, 'sampling': 'LHS', 'selection': 'RandomSelection'}. Best is trial 54 with value: 0.6197490814338504.
Trial 86 finished with value: 0.7420490733677009 and parameters: {'crossover_prob': 0.8707012870517737, 'crossover_eta': 14, 'mutation_prob': 0.7404058148901147, 'mutation_eta': 6, 'sampling': 'LHS', 'selection': 'TournamentSelection'}. Best is trial 54 with value: 0.6197490814338504.
Trial 88 finished with value: 0.7003360218726238 and parameters: {'crossover_prob': 0.8735594270221809, 'crossover_eta': 14, 'mutation_prob': 0.6142584887957717, 'mutation_eta': 5, 'sampling': 'LHS', 'selection': 'RandomSelection'}. Best is trial 54 with value: 0.6197490814338504.
Trial 89 finished with value: 0.691998498614981 and parameters: {'crossover_prob': 0.8750843273260248, 'crossover_eta': 15, 'mutation_prob': 0.7383247519614492, 'mutation_eta': 5, 'sampling': 'LHS', 'selection': 'RandomSelection'}. Best is trial 54 with value: 0.6197490814338504.
Trial 90 finished with value: 0.6838649039878383 and parameters: {'crossover_prob': 0.8716942109652025, 'crossover_eta': 14, 'mutation_prob': 0.7338360040545047, 'mutation_eta': 6, 'sampling': 'LHS', 'selection': 'RandomSelection'}. Best is trial 54 with value: 0.6197490814338504.
Trial 91 finished with value: 0.6830298210740459 and parameters: {'crossover_prob': 0.8770439530468788, 'crossover_eta': 13, 'mutation_prob': 0.6128043634912765, 'mutation_eta': 5, 'sampling': 'LHS', 'selection': 'RandomSelection'}. Best is trial 54 with value: 0.6197490814338504.
Trial 92 finished with value: 0.6876270554867863 and parameters: {'crossover_prob': 0.8802150843804954, 'crossover_eta': 13, 'mutation_prob': 0.49956110612133126, 'mutation_eta': 5, 'sampling': 'LHS', 'selection': 'RandomSelection'}. Best is trial 54 with value: 0.6197490814338504.
Trial 94 finished with value: 0.6395223294108654 and parameters: {'crossover_prob': 0.8745263339346752, 'crossover_eta': 14, 'mutation_prob': 0.6120911318696372, 'mutation_eta': 5, 'sampling': 'LHS', 'selection': 'TournamentSelection'}. Best is trial 54 with value: 0.6197490814338504.
Trial 93 finished with value: 0.6791241819359733 and parameters: {'crossover_prob': 0.8847964152468025, 'crossover_eta': 15, 'mutation_prob': 0.6116049036423192, 'mutation_eta': 8, 'sampling': 'LHS', 'selection': 'RandomSelection'}. Best is trial 54 with value: 0.6197490814338504.
Trial 95 finished with value: 0.6427509338499049 and parameters: {'crossover_prob': 0.8673546978239579, 'crossover_eta': 14, 'mutation_prob': 0.6118781559159612, 'mutation_eta': 5, 'sampling': 'LHS', 'selection': 'TournamentSelection'}. Best is trial 54 with value: 0.6197490814338504.
Trial 96 finished with value: 0.6912234068603433 and parameters: {'crossover_prob': 0.8748849740030545, 'crossover_eta': 14, 'mutation_prob': 0.7755417246234428, 'mutation_eta': 5, 'sampling': 'LHS', 'selection': 'TournamentSelection'}. Best is trial 54 with value: 0.6197490814338504.
Trial 97 finished with value: 0.694571991683206 and parameters: {'crossover_prob': 0.8678172165383995, 'crossover_eta': 14, 'mutation_prob': 0.6169249552259638, 'mutation_eta': 5, 'sampling': 'LHS', 'selection': 'TournamentSelection'}. Best is trial 54 with value: 0.6197490814338504.
Trial 98 finished with value: 0.658303278096374 and parameters: {'crossover_prob': 0.8723381539841997, 'crossover_eta': 10, 'mutation_prob': 0.6120720155996756, 'mutation_eta': 8, 'sampling': 'FloatRandomSampling', 'selection': 'TournamentSelection'}. Best is trial 54 with value: 0.6197490814338504.
Trial 99 finished with value: 0.6975787254562814 and parameters: {'crossover_prob': 0.8780265632094179, 'crossover_eta': 10, 'mutation_prob': 0.5089765080945496, 'mutation_eta': 8, 'sampling': 'FloatRandomSampling', 'selection': 'TournamentSelection'}. Best is trial 54 with value: 0.6197490814338504.

best params:  {'crossover_prob': 0.7779860983230351, 'crossover_eta': 7, 'mutation_prob': 0.8119322673317427, 'mutation_eta': 9, 'sampling': 'LHS', 'selection': 'TournamentSelection'} best value:  0.6197490814338504
--------------------------Finish  NSGA2  optimization--------------------------


