--------------------------Start  NSGA2  optimization--------------------------
A new study created in memory with name: algs_para_setting
Trial 7 finished with best value: 0.6390993363287655 and parameters: {'crossover_prob': 0.9575593971029379, 'crossover_eta': 8, 'mutation_prob': 0.5852023929910503, 'mutation_eta': 7, 'sampling': 'FloatRandomSampling', 'selection': 'TournamentSelection'}. 
Trial 7 finished with value: 0.6390993363287655 and parameters: {'crossover_prob': 0.9575593971029379, 'crossover_eta': 8, 'mutation_prob': 0.5852023929910503, 'mutation_eta': 7, 'sampling': 'FloatRandomSampling', 'selection': 'TournamentSelection'}. Best is trial 7 with value: 0.6390993363287655.
Trial 15 finished with value: 0.7528528248095546 and parameters: {'crossover_prob': 0.8846945786435674, 'crossover_eta': 15, 'mutation_prob': 0.928059786566918, 'mutation_eta': 11, 'sampling': 'FloatRandomSampling', 'selection': 'TournamentSelection'}. Best is trial 7 with value: 0.6390993363287655.
Trial 6 finished with value: 0.6513043908535574 and parameters: {'crossover_prob': 0.8085479614721515, 'crossover_eta': 12, 'mutation_prob': 0.6154858250553438, 'mutation_eta': 15, 'sampling': 'FloatRandomSampling', 'selection': 'TournamentSelection'}. Best is trial 7 with value: 0.6390993363287655.
Trial 11 finished with value: 0.6792341281695871 and parameters: {'crossover_prob': 0.9052489885203219, 'crossover_eta': 26, 'mutation_prob': 0.2689817586285572, 'mutation_eta': 28, 'sampling': 'LHS', 'selection': 'RandomSelection'}. Best is trial 7 with value: 0.6390993363287655.
Trial 8 finished with value: 0.7180859201103567 and parameters: {'crossover_prob': 0.7469219503967924, 'crossover_eta': 27, 'mutation_prob': 0.6568958626698682, 'mutation_eta': 15, 'sampling': 'FloatRandomSampling', 'selection': 'TournamentSelection'}. Best is trial 7 with value: 0.6390993363287655.
Trial 13 finished with value: 0.6792286987435789 and parameters: {'crossover_prob': 0.7489886832762308, 'crossover_eta': 10, 'mutation_prob': 0.7545562177932869, 'mutation_eta': 29, 'sampling': 'LHS', 'selection': 'RandomSelection'}. Best is trial 7 with value: 0.6390993363287655.
Trial 9 finished with value: 0.6705002540513705 and parameters: {'crossover_prob': 0.7185693350133728, 'crossover_eta': 25, 'mutation_prob': 0.5486921462246357, 'mutation_eta': 18, 'sampling': 'LHS', 'selection': 'TournamentSelection'}. Best is trial 7 with value: 0.6390993363287655.
 Trial 14 finished with value: 0.8563535628110504 and parameters: {'crossover_prob': 0.4656758624469246, 'crossover_eta': 5, 'mutation_prob': 0.6714248170477388, 'mutation_eta': 12, 'sampling': 'LHS', 'selection': 'RandomSelection'}. Best is trial 7 with value: 0.6390993363287655.
Trial 0 finished with value: 1.228263143186219 and parameters: {'crossover_prob': 0.20781489113215235, 'crossover_eta': 6, 'mutation_prob': 0.9116132884800483, 'mutation_eta': 28, 'sampling': 'LHS', 'selection': 'TournamentSelection'}. Best is trial 7 with value: 0.6390993363287655.
Trial 5 finished with value: 0.6971480454821677 and parameters: {'crossover_prob': 0.5139724525669138, 'crossover_eta': 27, 'mutation_prob': 0.16125090065032988, 'mutation_eta': 18, 'sampling': 'FloatRandomSampling', 'selection': 'RandomSelection'}. Best is trial 7 with value: 0.6390993363287655.
Trial 12 finished with value: 0.8159139740141379 and parameters: {'crossover_prob': 0.46489825066647417, 'crossover_eta': 27, 'mutation_prob': 0.3134376957146122, 'mutation_eta': 12, 'sampling': 'FloatRandomSampling', 'selection': 'RandomSelection'}. Best is trial 7 with value: 0.6390993363287655.
Trial 2 finished with value: 1.0118226962545898 and parameters: {'crossover_prob': 0.4872503609552018, 'crossover_eta': 28, 'mutation_prob': 0.26649025112925195, 'mutation_eta': 23, 'sampling': 'FloatRandomSampling', 'selection': 'TournamentSelection'}. Best is trial 7 with value: 0.6390993363287655.
Trial 3 finished with value: 1.3249328584653746 and parameters: {'crossover_prob': 0.16419674384435612, 'crossover_eta': 10, 'mutation_prob': 0.7317898391537542, 'mutation_eta': 14, 'sampling': 'FloatRandomSampling', 'selection': 'TournamentSelection'}. Best is trial 7 with value: 0.6390993363287655.
Trial 16 finished with value: 0.8133375501114843 and parameters: {'crossover_prob': 0.6948246210795642, 'crossover_eta': 27, 'mutation_prob': 0.4707782073052357, 'mutation_eta': 7, 'sampling': 'FloatRandomSampling', 'selection': 'TournamentSelection'}. Best is trial 7 with value: 0.6390993363287655.
Trial 20 finished with value: 0.660513805196044 and parameters: {'crossover_prob': 0.9090842746108105, 'crossover_eta': 16, 'mutation_prob': 0.46819839618542947, 'mutation_eta': 5, 'sampling': 'LHS', 'selection': 'TournamentSelection'}. Best is trial 7 with value: 0.6390993363287655.
Trial 17 finished with value: 0.8605748703144567 and parameters: {'crossover_prob': 0.5305836486798952, 'crossover_eta': 3, 'mutation_prob': 0.48265148824355086, 'mutation_eta': 19, 'sampling': 'LHS', 'selection': 'RandomSelection'}. Best is trial 7 with value: 0.6390993363287655.
Trial 10 finished with value: 0.9545299964939468 and parameters: {'crossover_prob': 0.3241679102453986, 'crossover_eta': 8, 'mutation_prob': 0.368945391848825, 'mutation_eta': 16, 'sampling': 'FloatRandomSampling', 'selection': 'TournamentSelection'}. Best is trial 7 with value: 0.6390993363287655.
Trial 18 finished with value: 0.7296408218620415 and parameters: {'crossover_prob': 0.5547334297737709, 'crossover_eta': 16, 'mutation_prob': 0.20374245263066793, 'mutation_eta': 8, 'sampling': 'FloatRandomSampling', 'selection': 'RandomSelection'}. Best is trial 7 with value: 0.6390993363287655.
Trial 1 finished with value: 1.241526400181063 and parameters: {'crossover_prob': 0.15558807474968062, 'crossover_eta': 21, 'mutation_prob': 0.4501580061239896, 'mutation_eta': 10, 'sampling': 'FloatRandomSampling', 'selection': 'RandomSelection'}. Best is trial 7 with value: 0.6390993363287655.
Trial 27 finished with value: 0.7014834566735064 and parameters: {'crossover_prob': 0.9974007284833883, 'crossover_eta': 13, 'mutation_prob': 0.46909726542011415, 'mutation_eta': 3, 'sampling': 'FloatRandomSampling', 'selection': 'TournamentSelection'}. Best is trial 7 with value: 0.6390993363287655.
Trial 25 finished with value: 0.7178665371719072 and parameters: {'crossover_prob': 0.9883144965952625, 'crossover_eta': 20, 'mutation_prob': 0.348413486919962, 'mutation_eta': 3, 'sampling': 'FloatRandomSampling', 'selection': 'TournamentSelection'}. Best is trial 7 with value: 0.6390993363287655.
Trial 26 finished with value: 0.7142631646869498 and parameters: {'crossover_prob': 0.9771678969469083, 'crossover_eta': 14, 'mutation_prob': 0.4535818066100259, 'mutation_eta': 3, 'sampling': 'FloatRandomSampling', 'selection': 'TournamentSelection'}. Best is trial 7 with value: 0.6390993363287655.
Trial 28 finished with value: 0.6613564581540009 and parameters: {'crossover_prob': 0.9862886352888073, 'crossover_eta': 18, 'mutation_prob': 0.4455501740810945, 'mutation_eta': 3, 'sampling': 'FloatRandomSampling', 'selection': 'TournamentSelection'}. Best is trial 7 with value: 0.6390993363287655.
Trial 29 finished with value: 0.7073082572691056 and parameters: {'crossover_prob': 0.9470356930585413, 'crossover_eta': 17, 'mutation_prob': 0.018146621844484345, 'mutation_eta': 4, 'sampling': 'FloatRandomSampling', 'selection': 'TournamentSelection'}. Best is trial 7 with value: 0.6390993363287655.
Trial 31 finished with value: 0.7756344032846556 and parameters: {'crossover_prob': 0.9926396474241338, 'crossover_eta': 21, 'mutation_prob': 0.05046141364762524, 'mutation_eta': 3, 'sampling': 'FloatRandomSampling', 'selection': 'TournamentSelection'}. Best is trial 7 with value: 0.6390993363287655.
Trial 30 finished with value: 0.7268928885217613 and parameters: {'crossover_prob': 0.8904139981270659, 'crossover_eta': 20, 'mutation_prob': 0.01711675046427452, 'mutation_eta': 3, 'sampling': 'FloatRandomSampling', 'selection': 'TournamentSelection'}. Best is trial 7 with value: 0.6390993363287655.
Trial 24 finished with value: 3.3668057882337776 and parameters: {'crossover_prob': 0.0036159071119807873, 'crossover_eta': 29, 'mutation_prob': 0.7761394039214068, 'mutation_eta': 6, 'sampling': 'FloatRandomSampling', 'selection': 'TournamentSelection'}. Best is trial 7 with value: 0.6390993363287655.
Trial 33 finished with value: 0.6633841822996316 and parameters: {'crossover_prob': 0.9949818984911383, 'crossover_eta': 21, 'mutation_prob': 0.07707339310925054, 'mutation_eta': 4, 'sampling': 'FloatRandomSampling', 'selection': 'TournamentSelection'}. Best is trial 7 with value: 0.6390993363287655.
Trial 32 finished with value: 0.7119540116544283 and parameters: {'crossover_prob': 0.9753192973402098, 'crossover_eta': 20, 'mutation_prob': 0.027529862436628583, 'mutation_eta': 3, 'sampling': 'FloatRandomSampling', 'selection': 'TournamentSelection'}. Best is trial 7 with value: 0.6390993363287655.
Trial 22 finished with value: 0.8179880853724667 and parameters: {'crossover_prob': 0.3733915013613719, 'crossover_eta': 17, 'mutation_prob': 0.20366353998239228, 'mutation_eta': 4, 'sampling': 'FloatRandomSampling', 'selection': 'RandomSelection'}. Best is trial 7 with value: 0.6390993363287655.
Trial 34 finished with value: 0.671618696851396 and parameters: {'crossover_prob': 0.9792281802359268, 'crossover_eta': 12, 'mutation_prob': 0.079734775310348, 'mutation_eta': 3, 'sampling': 'FloatRandomSampling', 'selection': 'TournamentSelection'}. Best is trial 7 with value: 0.6390993363287655.
Trial 35 finished with value: 0.6661263947511917 and parameters: {'crossover_prob': 0.99227735897, 'crossover_eta': 19, 'mutation_prob': 0.11043769705382955, 'mutation_eta': 24, 'sampling': 'FloatRandomSampling', 'selection': 'TournamentSelection'}. Best is trial 7 with value: 0.6390993363287655.
Trial 39 finished with value: 0.6248471043901455 and parameters: {'crossover_prob': 0.8488669924701433, 'crossover_eta': 12, 'mutation_prob': 0.6762894701670696, 'mutation_eta': 6, 'sampling': 'LHS', 'selection': 'TournamentSelection'}. Best is trial 39 with value: 0.6248471043901455.
Trial 39 finished with best value: 0.6248471043901455 and parameters: {'crossover_prob': 0.8488669924701433, 'crossover_eta': 12, 'mutation_prob': 0.6762894701670696, 'mutation_eta': 6, 'sampling': 'LHS', 'selection': 'TournamentSelection'}. 
Trial 36 finished with value: 0.6252271317665082 and parameters: {'crossover_prob': 0.849671035080682, 'crossover_eta': 12, 'mutation_prob': 0.05760974868468338, 'mutation_eta': 6, 'sampling': 'LHS', 'selection': 'TournamentSelection'}. Best is trial 39 with value: 0.6248471043901455.
Trial 37 finished with value: 0.6821816158305041 and parameters: {'crossover_prob': 0.8465882102019991, 'crossover_eta': 11, 'mutation_prob': 0.5824117714585775, 'mutation_eta': 7, 'sampling': 'LHS', 'selection': 'TournamentSelection'}. Best is trial 39 with value: 0.6248471043901455.
Trial 40 finished with value: 0.7733680004604282 and parameters: {'crossover_prob': 0.849958793899797, 'crossover_eta': 12, 'mutation_prob': 0.5834272201748981, 'mutation_eta': 7, 'sampling': 'LHS', 'selection': 'TournamentSelection'}. Best is trial 39 with value: 0.6248471043901455.
Trial 38 finished with value: 0.6268499519850224 and parameters: {'crossover_prob': 0.8389523921013915, 'crossover_eta': 11, 'mutation_prob': 0.5794341475239215, 'mutation_eta': 7, 'sampling': 'LHS', 'selection': 'TournamentSelection'}. Best is trial 39 with value: 0.6248471043901455.
Trial 43 finished with value: 0.6826011962122724 and parameters: {'crossover_prob': 0.835272263697248, 'crossover_eta': 12, 'mutation_prob': 0.5900182501412852, 'mutation_eta': 22, 'sampling': 'LHS', 'selection': 'TournamentSelection'}. Best is trial 39 with value: 0.6248471043901455.
Trial 41 finished with value: 0.656964522282843 and parameters: {'crossover_prob': 0.8349814249793821, 'crossover_eta': 12, 'mutation_prob': 0.5791397301874059, 'mutation_eta': 7, 'sampling': 'LHS', 'selection': 'TournamentSelection'}. Best is trial 39 with value: 0.6248471043901455.
Trial 42 finished with value: 0.6318525372434758 and parameters: {'crossover_prob': 0.814897723064343, 'crossover_eta': 11, 'mutation_prob': 0.5537698076003073, 'mutation_eta': 8, 'sampling': 'LHS', 'selection': 'TournamentSelection'}. Best is trial 39 with value: 0.6248471043901455.
Trial 44 finished with value: 0.683816817836544 and parameters: {'crossover_prob': 0.803508258811118, 'crossover_eta': 11, 'mutation_prob': 0.5671990187259952, 'mutation_eta': 9, 'sampling': 'LHS', 'selection': 'TournamentSelection'}. Best is trial 39 with value: 0.6248471043901455.
Trial 45 finished with value: 0.7590133960925829 and parameters: {'crossover_prob': 0.8476476574439603, 'crossover_eta': 12, 'mutation_prob': 0.5780414377576303, 'mutation_eta': 9, 'sampling': 'LHS', 'selection': 'TournamentSelection'}. Best is trial 39 with value: 0.6248471043901455.
Trial 46 finished with value: 0.6976826261987055 and parameters: {'crossover_prob': 0.8393230306701204, 'crossover_eta': 11, 'mutation_prob': 0.599339165997038, 'mutation_eta': 9, 'sampling': 'LHS', 'selection': 'TournamentSelection'}. Best is trial 39 with value: 0.6248471043901455.
Trial 47 finished with value: 0.6735144745375722 and parameters: {'crossover_prob': 0.8306591134793392, 'crossover_eta': 11, 'mutation_prob': 0.5560808312596898, 'mutation_eta': 9, 'sampling': 'LHS', 'selection': 'TournamentSelection'}. Best is trial 39 with value: 0.6248471043901455.
Trial 48 finished with value: 0.7411022990129243 and parameters: {'crossover_prob': 0.8192865393449251, 'crossover_eta': 11, 'mutation_prob': 0.5642743900743044, 'mutation_eta': 8, 'sampling': 'LHS', 'selection': 'TournamentSelection'}. Best is trial 39 with value: 0.6248471043901455.
Trial 51 finished with value: 0.7460656586891464 and parameters: {'crossover_prob': 0.8122378373194872, 'crossover_eta': 7, 'mutation_prob': 0.8393317322862176, 'mutation_eta': 9, 'sampling': 'LHS', 'selection': 'TournamentSelection'}. Best is trial 39 with value: 0.6248471043901455.
Trial 50 finished with value: 0.7047806908928077 and parameters: {'crossover_prob': 0.8317722578427946, 'crossover_eta': 8, 'mutation_prob': 0.5380668187669783, 'mutation_eta': 9, 'sampling': 'LHS', 'selection': 'TournamentSelection'}. Best is trial 39 with value: 0.6248471043901455.
Trial 49 finished with value: 0.6524906724176686 and parameters: {'crossover_prob': 0.8249832218457489, 'crossover_eta': 11, 'mutation_prob': 0.5791496411024072, 'mutation_eta': 9, 'sampling': 'LHS', 'selection': 'TournamentSelection'}. Best is trial 39 with value: 0.6248471043901455.
Trial 52 finished with value: 0.6700056870169286 and parameters: {'crossover_prob': 0.8097108111598066, 'crossover_eta': 8, 'mutation_prob': 0.8266397207671098, 'mutation_eta': 9, 'sampling': 'LHS', 'selection': 'TournamentSelection'}. Best is trial 39 with value: 0.6248471043901455.
Trial 53 finished with value: 0.6199624326176477 and parameters: {'crossover_prob': 0.8058436218832695, 'crossover_eta': 8, 'mutation_prob': 0.8457577894828784, 'mutation_eta': 9, 'sampling': 'LHS', 'selection': 'TournamentSelection'}. Best is trial 53 with value: 0.6199624326176477.
Trial 53 finished with best value: 0.6199624326176477 and parameters: {'crossover_prob': 0.8058436218832695, 'crossover_eta': 8, 'mutation_prob': 0.8457577894828784, 'mutation_eta': 9, 'sampling': 'LHS', 'selection': 'TournamentSelection'}. 
Trial 19 finished with value: 0.976670184889312 and parameters: {'crossover_prob': 0.10315228369873419, 'crossover_eta': 24, 'mutation_prob': 0.2711799335859175, 'mutation_eta': 8, 'sampling': 'LHS', 'selection': 'RandomSelection'}. Best is trial 53 with value: 0.6199624326176477.
Trial 54 finished with value: 0.6197490814338504 and parameters: {'crossover_prob': 0.7779860983230351, 'crossover_eta': 7, 'mutation_prob': 0.8119322673317427, 'mutation_eta': 9, 'sampling': 'LHS', 'selection': 'TournamentSelection'}. Best is trial 54 with value: 0.6197490814338504.
Trial 54 finished with best value: 0.6197490814338504 and parameters: {'crossover_prob': 0.7779860983230351, 'crossover_eta': 7, 'mutation_prob': 0.8119322673317427, 'mutation_eta': 9, 'sampling': 'LHS', 'selection': 'TournamentSelection'}. 
Trial 4 finished with value: 1.050439992834509 and parameters: {'crossover_prob': 0.11278236896687888, 'crossover_eta': 29, 'mutation_prob': 0.13252937217759853, 'mutation_eta': 17, 'sampling': 'LHS', 'selection': 'RandomSelection'}. Best is trial 54 with value: 0.6197490814338504.
Trial 55 finished with value: 0.6616048231245334 and parameters: {'crossover_prob': 0.7864540332860497, 'crossover_eta': 8, 'mutation_prob': 0.8354511880564567, 'mutation_eta': 9, 'sampling': 'LHS', 'selection': 'TournamentSelection'}. Best is trial 54 with value: 0.6197490814338504.
Trial 57 finished with value: 0.7625960374216879 and parameters: {'crossover_prob': 0.7824416332343163, 'crossover_eta': 8, 'mutation_prob': 0.5318432320561944, 'mutation_eta': 10, 'sampling': 'LHS', 'selection': 'TournamentSelection'}. Best is trial 54 with value: 0.6197490814338504.
Trial 58 finished with value: 0.6859529786481725 and parameters: {'crossover_prob': 0.7721346634881296, 'crossover_eta': 8, 'mutation_prob': 0.524548995271894, 'mutation_eta': 13, 'sampling': 'LHS', 'selection': 'TournamentSelection'}. Best is trial 54 with value: 0.6197490814338504.
Trial 60 finished with value: 0.662124855068018 and parameters: {'crossover_prob': 0.7590454189469279, 'crossover_eta': 8, 'mutation_prob': 0.6929540888212625, 'mutation_eta': 12, 'sampling': 'LHS', 'selection': 'TournamentSelection'}. Best is trial 54 with value: 0.6197490814338504.
Trial 56 finished with value: 0.6685663393977642 and parameters: {'crossover_prob': 0.6515837292065012, 'crossover_eta': 7, 'mutation_prob': 0.6578339565832241, 'mutation_eta': 10, 'sampling': 'LHS', 'selection': 'TournamentSelection'}. Best is trial 54 with value: 0.6197490814338504.
Trial 59 finished with value: 0.6203678820857661 and parameters: {'crossover_prob': 0.7674761448226597, 'crossover_eta': 8, 'mutation_prob': 0.6949816824620392, 'mutation_eta': 12, 'sampling': 'LHS', 'selection': 'TournamentSelection'}. Best is trial 54 with value: 0.6197490814338504.
Trial 61 finished with value: 0.7677210175673225 and parameters: {'crossover_prob': 0.772883500164995, 'crossover_eta': 9, 'mutation_prob': 0.6858405969150531, 'mutation_eta': 13, 'sampling': 'LHS', 'selection': 'TournamentSelection'}. Best is trial 54 with value: 0.6197490814338504.
Trial 63 finished with value: 0.6415090924684137 and parameters: {'crossover_prob': 0.9265120732951126, 'crossover_eta': 9, 'mutation_prob': 0.6521317233073755, 'mutation_eta': 12, 'sampling': 'LHS', 'selection': 'TournamentSelection'}. Best is trial 54 with value: 0.6197490814338504.
Trial 21 finished with value: 1.6241713960922555 and parameters: {'crossover_prob': 0.07919322536531315, 'crossover_eta': 11, 'mutation_prob': 0.21512177535899146, 'mutation_eta': 28, 'sampling': 'LHS', 'selection': 'TournamentSelection'}. Best is trial 54 with value: 0.6197490814338504.
Trial 66 finished with value: 0.7166405311924611 and parameters: {'crossover_prob': 0.9320922785195906, 'crossover_eta': 9, 'mutation_prob': 0.6460107469368094, 'mutation_eta': 13, 'sampling': 'LHS', 'selection': 'TournamentSelection'}. Best is trial 54 with value: 0.6197490814338504.
Trial 62 finished with value: 0.6516844258126232 and parameters: {'crossover_prob': 0.6822706722014633, 'crossover_eta': 9, 'mutation_prob': 0.6378253480289693, 'mutation_eta': 11, 'sampling': 'LHS', 'selection': 'TournamentSelection'}. Best is trial 54 with value: 0.6197490814338504.
Trial 65 finished with value: 0.7274321317373847 and parameters: {'crossover_prob': 0.6680571492003077, 'crossover_eta': 9, 'mutation_prob': 0.6580190558033456, 'mutation_eta': 12, 'sampling': 'LHS', 'selection': 'RandomSelection'}. Best is trial 54 with value: 0.6197490814338504.
Trial 64 finished with value: 0.8252872960346821 and parameters: {'crossover_prob': 0.7537612218658388, 'crossover_eta': 9, 'mutation_prob': 0.6487943675289751, 'mutation_eta': 13, 'sampling': 'LHS', 'selection': 'RandomSelection'}. Best is trial 54 with value: 0.6197490814338504.
Trial 67 finished with value: 0.6541932112986675 and parameters: {'crossover_prob': 0.7709560289135361, 'crossover_eta': 5, 'mutation_prob': 0.6544682089886571, 'mutation_eta': 11, 'sampling': 'LHS', 'selection': 'TournamentSelection'}. Best is trial 54 with value: 0.6197490814338504.
Trial 68 finished with value: 0.7261988648221764 and parameters: {'crossover_prob': 0.7687506648279612, 'crossover_eta': 6, 'mutation_prob': 0.6582059854504204, 'mutation_eta': 13, 'sampling': 'LHS', 'selection': 'TournamentSelection'}. Best is trial 54 with value: 0.6197490814338504.
Trial 69 finished with value: 0.6825427093071142 and parameters: {'crossover_prob': 0.696035078624317, 'crossover_eta': 4, 'mutation_prob': 0.6457331033756215, 'mutation_eta': 12, 'sampling': 'LHS', 'selection': 'TournamentSelection'}. Best is trial 54 with value: 0.6197490814338504.
Trial 70 finished with value: 0.7364132493159647 and parameters: {'crossover_prob': 0.703389498962419, 'crossover_eta': 5, 'mutation_prob': 0.6574940424074291, 'mutation_eta': 13, 'sampling': 'LHS', 'selection': 'TournamentSelection'}. Best is trial 54 with value: 0.6197490814338504.
Trial 71 finished with value: 0.7545362784774275 and parameters: {'crossover_prob': 0.6988984718022471, 'crossover_eta': 6, 'mutation_prob': 0.693661469880182, 'mutation_eta': 11, 'sampling': 'LHS', 'selection': 'TournamentSelection'}. Best is trial 54 with value: 0.6197490814338504.
