Trial 82 finished with value: 0.6884604633588906 and parameters: {'crossover_prob': 0.8610907486311786, 'crossover_eta': 5, 'mutation_prob': 0.22532955479857597, 'mutation_eta': 21, 'sampling': 'FloatRandomSampling'}. Best is trial 77 with value: 0.6168431919374197.
Trial 83 finished with value: 0.6703956888696104 and parameters: {'crossover_prob': 0.8585563180171546, 'crossover_eta': 4, 'mutation_prob': 0.215463454496305, 'mutation_eta': 21, 'sampling': 'FloatRandomSampling'}. Best is trial 77 with value: 0.6168431919374197.
Trial 81 finished with value: 0.8208436080350913 and parameters: {'crossover_prob': 0.7656795997866593, 'crossover_eta': 5, 'mutation_prob': 0.2132500334483517, 'mutation_eta': 21, 'sampling': 'FloatRandomSampling'}. Best is trial 77 with value: 0.6168431919374197.
Trial 85 finished with value: 0.7160099003912485 and parameters: {'crossover_prob': 0.859858989037949, 'crossover_eta': 5, 'mutation_prob': 0.21875560475546862, 'mutation_eta': 21, 'sampling': 'FloatRandomSampling'}. Best is trial 77 with value: 0.6168431919374197.
Trial 84 finished with value: 0.6620946606635418 and parameters: {'crossover_prob': 0.8510607386834471, 'crossover_eta': 4, 'mutation_prob': 0.04715029133951251, 'mutation_eta': 20, 'sampling': 'FloatRandomSampling'}. Best is trial 77 with value: 0.6168431919374197.
Trial 86 finished with value: 0.7236934896517977 and parameters: {'crossover_prob': 0.7010786393995498, 'crossover_eta': 4, 'mutation_prob': 0.21675201035448502, 'mutation_eta': 30, 'sampling': 'FloatRandomSampling'}. Best is trial 77 with value: 0.6168431919374197.
Trial 87 finished with value: 0.657881982468275 and parameters: {'crossover_prob': 0.6886362484162438, 'crossover_eta': 4, 'mutation_prob': 0.22169837392746328, 'mutation_eta': 24, 'sampling': 'FloatRandomSampling'}. Best is trial 77 with value: 0.6168431919374197.
Trial 91 finished with value: 0.7186147694677427 and parameters: {'crossover_prob': 0.8600744167611906, 'crossover_eta': 5, 'mutation_prob': 0.22952049693643062, 'mutation_eta': 24, 'sampling': 'FloatRandomSampling'}. Best is trial 77 with value: 0.6168431919374197.
Trial 92 finished with value: 0.6876318815793124 and parameters: {'crossover_prob': 0.8601111187458106, 'crossover_eta': 4, 'mutation_prob': 0.20649322657242455, 'mutation_eta': 24, 'sampling': 'FloatRandomSampling'}. Best is trial 77 with value: 0.6168431919374197.
Trial 94 finished with value: 0.7457306094718242 and parameters: {'crossover_prob': 0.8624183385755135, 'crossover_eta': 4, 'mutation_prob': 0.020277326334520923, 'mutation_eta': 24, 'sampling': 'FloatRandomSampling'}. Best is trial 77 with value: 0.6168431919374197.
Trial 89 finished with value: 0.7779083497049315 and parameters: {'crossover_prob': 0.6894492039395187, 'crossover_eta': 4, 'mutation_prob': 0.21769335511553134, 'mutation_eta': 30, 'sampling': 'FloatRandomSampling'}. Best is trial 77 with value: 0.6168431919374197.
Trial 88 finished with value: 0.6593514200734436 and parameters: {'crossover_prob': 0.6811199255813838, 'crossover_eta': 5, 'mutation_prob': 0.009533868066202836, 'mutation_eta': 30, 'sampling': 'FloatRandomSampling'}. Best is trial 77 with value: 0.6168431919374197.
Trial 90 finished with value: 0.6309285840529507 and parameters: {'crossover_prob': 0.6691379760064113, 'crossover_eta': 6, 'mutation_prob': 0.20723521676447226, 'mutation_eta': 24, 'sampling': 'FloatRandomSampling'}. Best is trial 77 with value: 0.6168431919374197.
Trial 93 finished with value: 0.7043361092952777 and parameters: {'crossover_prob': 0.6793766086384859, 'crossover_eta': 6, 'mutation_prob': 0.019032195131048396, 'mutation_eta': 30, 'sampling': 'FloatRandomSampling'}. Best is trial 77 with value: 0.6168431919374197.
Trial 95 finished with value: 0.6706329564816788 and parameters: {'crossover_prob': 0.6908165914758804, 'crossover_eta': 4, 'mutation_prob': 0.016344311770075826, 'mutation_eta': 30, 'sampling': 'FloatRandomSampling'}. Best is trial 77 with value: 0.6168431919374197.
Trial 96 finished with value: 0.6544674079569668 and parameters: {'crossover_prob': 0.6864911031753549, 'crossover_eta': 4, 'mutation_prob': 0.02872975761178448, 'mutation_eta': 30, 'sampling': 'FloatRandomSampling'}. Best is trial 77 with value: 0.6168431919374197.
Trial 99 finished with value: 0.6545194627949833 and parameters: {'crossover_prob': 0.7015085785495314, 'crossover_eta': 6, 'mutation_prob': 0.008126176695203269, 'mutation_eta': 24, 'sampling': 'FloatRandomSampling'}. Best is trial 77 with value: 0.6168431919374197.
Trial 97 finished with value: 0.6972539944970707 and parameters: {'crossover_prob': 0.6728822178283856, 'crossover_eta': 4, 'mutation_prob': 0.01621351918440156, 'mutation_eta': 30, 'sampling': 'FloatRandomSampling'}. Best is trial 77 with value: 0.6168431919374197.
Trial 98 finished with value: 0.672975298518138 and parameters: {'crossover_prob': 0.6478609034453298, 'crossover_eta': 6, 'mutation_prob': 0.005194065411520787, 'mutation_eta': 24, 'sampling': 'FloatRandomSampling'}. Best is trial 77 with value: 0.6168431919374197.
best params:  {'crossover_prob': 0.7595329773789643, 'crossover_eta': 5, 'mutation_prob': 0.06751701492505702, 'mutation_eta': 28, 'sampling': 'FloatRandomSampling'} best value:  0.6168431919374197
--------------------------Finish  SMS_EMOA  optimization--------------------------
